{
  "protocol": "action-parity/sync@0.1",
  "type": "sync.conflict",
  "stream_id": "task:task_demo_42",
  "message_id": "msg_conflict_attention_01",
  "sent_at": "2026-07-25T05:30:01Z",
  "payload": {
    "action_id": "attention.decision",
    "execution_id": "exec_attention_01",
    "expected_state_version": 42,
    "current_state_version": 44,
    "resolution": "refresh"
  }
}
